{"$defs":{"BudgetWire":{"additionalProperties":false,"properties":{"canonical_candidate_tokens":{"format":"uint64","minimum":0,"type":"integer"},"peak_memory_bytes":{"format":"uint64","minimum":0,"type":"integer"},"unique_candidate_event_count":{"format":"uint64","minimum":0,"type":"integer"},"unique_candidate_source_bytes":{"format":"uint64","minimum":0,"type":"integer"},"wall_time_nanos":{"format":"uint64","minimum":0,"type":"integer"}},"required":["unique_candidate_event_count","unique_candidate_source_bytes","canonical_candidate_tokens","wall_time_nanos","peak_memory_bytes"],"type":"object"}},"$id":"schemas/evidentrail/v1/bench_case_manifest.schema.json","$schema":"https://json-schema.org/draft/2020-12/schema","additionalProperties":false,"properties":{"budget_points":{"items":{"$ref":"#/$defs/BudgetWire"},"maxItems":4096,"type":"array"},"contract":{"const":"evidentrail.bench.case_manifest","type":"string"},"contract_version":{"const":1,"format":"uint16","maximum":9007199254740991,"minimum":0,"type":"integer"},"expected_acquisition_class":{"type":"string"},"leakage_artifact_digests":{"items":{"type":"string"},"maxItems":4096,"type":"array"},"plan_digest":{"pattern":"^plan_sha256_[0-9a-f]{64}$","type":"string"},"question_digest":{"pattern":"^question_sha256_[0-9a-f]{64}$","type":"string"},"source_artifact_digests":{"items":{"type":"string"},"maxItems":4096,"type":"array"},"split_artifact_digests":{"items":{"type":"string"},"maxItems":4096,"type":"array"}},"required":["contract","contract_version","source_artifact_digests","question_digest","plan_digest","split_artifact_digests","leakage_artifact_digests","budget_points","expected_acquisition_class"],"title":"evidentrail.bench.case_manifest","type":"object"}