{"budget_points":[{"canonical_candidate_tokens":0,"peak_memory_bytes":0,"unique_candidate_event_count":0,"unique_candidate_source_bytes":0,"wall_time_nanos":0}],"contract":"evidentrail.bench.case_manifest","contract_version":1,"expected_acquisition_class":"complete","leakage_artifact_digests":["artifact_sha256_0000000000000000000000000000000000000000000000000000000000000000"],"plan_digest":"plan_sha256_0000000000000000000000000000000000000000000000000000000000000000","question_digest":"question_sha256_0000000000000000000000000000000000000000000000000000000000000000","source_artifact_digests":["artifact_sha256_0000000000000000000000000000000000000000000000000000000000000000"],"split_artifact_digests":["artifact_sha256_0000000000000000000000000000000000000000000000000000000000000000"]}